{
  "patient_code": "PT-5A1F0C",
  "schema_version": "2.1",
  "generated_at": "2030-01-20T09:00:00Z",
  "reports": [],
  "variants": [],
  "ihc": [],
  "msi_results": [],
  "mmr_results": [],
  "hla_typing": [
    {
      "locus": "A",
      "allele": "A*02:01",
      "resolution": "2-field",
      "method": null,
      "provenance_layer": "prior_archive",
      "verification_status": "unverified",
      "source_refs": [
        "03_病程与叙事文书/既往档案摘录/2029-06-01_既往档案摘录.md#L17"
      ]
    }
  ]
}
